{
  "id": "one-source-inventory-policy",
  "statement": "One exclusion policy should define repository source inventory",
  "rationale": "Retrieval, evidence pins, memory pins and verification scope must agree about what source exists. Two rules currently disagree; a broad glob pinned the 161 MB Briefcase database and agent artifacts, which would make freshness permanently stale. Consolidating the exclusions prevents an ordinary tool artifact from becoming architecture input.",
  "origin": "agent_inferred",
  "references": [
    "case:technical-debt-audit-2026-10",
    "signal:source-inventory-rules-diverge",
    "repo:archclt@ba17fd6"
  ],
  "components": [
    "core"
  ],
  "paths": [
    "src/archctl/core/context.py",
    "src/archctl/core/io.py"
  ],
  "topics": [
    "inventory",
    "freshness",
    "evidence",
    "exclusions"
  ],
  "assumptions": [
    "Tool artifacts are not application source.",
    "Component bindings should stay source-specific."
  ],
  "supersedes": [],
  "contradicts": [],
  "source_files": {
    "src/archctl/core/context.py": "45c85b1c1c27adfc564dadd1ec1ef0226c772123eda940560385e31c9788937e",
    "src/archctl/core/io.py": "e0588df720150615b019321d156b4c36ab11aee60a506ec14c5beec1af96cdb9"
  },
  "schema_version": "archctl.memory.v1",
  "revision": "9aaf47f11d544e3d7cd800c7dad649fdcb6a3d8871a069a94e4d87f48a1141e8"
}
